cmd,conds,short,long,params,dirs,pri,desc
$progname, $noopt, , ,-D, ,101,Modify the package database
$progname, $noopt, , ,-Q, ,102,Query the package database
$progname, $noopt,D,database, ,@f,103,Modify the package database
$progname, $noopt,Q,query, ,@f,104,Query the package database
$progname, $noopt,R,remove, ,@f,105,Remove packages from the system
$progname, $noopt,S,sync, ,@f,106,Synchronize packages
$progname, $noopt,T,deptest, ,@f,107,Check dependencies
$progname, $noopt,U,upgrade, ,@f,108,Upgrade or add a local package
$progname, $noopt,F,files, ,@f,109,Query the files database
$progname, $noopt,V,version, ,@f,110,Display version and exit
$progname, ,h,help, ,@f,111,Display help
$progname, $noopt,b,dbpath, ,@D,112,Alternate database location
$progname, $noopt,r,root, ,@D,113,Alternate installation root
$progname, $noopt,v,verbose, , ,114,Output more status messages
$progname, $noopt, ,arch, , ,115,Alternate architecture
$progname, $noopt, ,cachedir, ,@D,116,Alternate package cache location
$progname, $noopt, ,color,{auto,always,never}, ,117,Colorize the output
$progname, $noopt, ,config, , ,118,Alternate config file
$progname, $noopt, ,confirm, , ,119,Always ask for confirmation
$progname, $noopt, ,debug, , ,120,Display debug messages
$progname, $noopt, ,disable-download-timeout, , ,121,Use relaxed timeouts for download
$progname, $noopt, ,gpgdir, ,@D,122,Alternate home directory for GnuPG
$progname, $noopt, ,hookdir, ,@D,123,Alternate hook location
$progname, $noopt, ,logfile, , ,124,Alternate log file
$progname, $noopt, ,noconfirm, , ,125,Bypass any confirmation
$progname, $noopt, ,sysroot, ,@D,126,Operate on a mounted guest system (root-only)
$progname, $$condition,q,quiet, , ,127,Show less information
$progname, $$condition,d,nodeps, , ,128,Skip [all] dependency checks
$progname, $$condition,p,print, , ,129,"Dry run, only print targets"
$progname, $$condition, ,assume-installed, , ,130,Add a virtual package to satisfy dependencies
$progname, $$condition, ,dbonly, , ,131,Modify database entry only
$progname, $$condition, ,noprogressbar, , ,132,Do not display progress bar
$progname, $$condition, ,noscriptlet, , ,133,Do not execute install script
$progname, $$condition, ,print-format, , ,134,Specify printf-like format
$progname, $$condition,l,list, , ,135,List the files owned by PACKAGE
$progname, $$condition,y,refresh, , ,136,Download fresh package databases [force]
$progname, $$condition,g,groups,$listgroups, ,137,Display members of [all] package GROUP
$progname, $$condition, ,asdeps, , ,138,Install packages as non-explicitly installed
$progname, $$condition, ,asexplicit, , ,139,Install packages as explicitly installed
$progname, $$condition, ,ignore,$listall, ,140,Ignore a package upgrade (can be used more than once)
$progname, $$condition, ,ignoregroup,$listgroups, ,141,Ignore a group upgrade (can be used more than once)
$progname, $$condition, ,needed, , ,142,Do not reinstall up to date packages
$progname, $$condition, ,overwrite, , ,143,Overwrite conflicting files (can be used more than once)
$progname," $database; and $has_db_opt",k,check, , ,144,Check database validity
$progname, $database,q,quite, , ,145,Suppress output of success messages
$progname," $database; and $has_db_opt", ,asdeps, , ,146,Mark PACKAGE as dependency
$progname," $database; and $has_db_opt", ,asexplicit, , ,147,Mark PACKAGE as explicitly installed
$progname," $has_db_opt; and $database", , ,$listinstalled, ,148, 
$progname, $files,x,regex, , ,149,Interpret each query as a regular expression
$progname, $files, ,machinereadable, , ,150,Print each match in a machine readable output format
$progname, $files, , ,$listpacman, ,151,Package
$progname, $query,c,changelog, , ,152,View the change log of PACKAGE
$progname, $query,d,deps, , ,153,List only non-explicit packages (dependencies)
$progname, $query,e,explicit, , ,154,List only explicitly installed packages
$progname, $query,i,info, , ,155,View PACKAGE [backup files] information
$progname, $query,k,check, , ,156,Check that PACKAGE files exist
$progname, $query,m,foreign, , ,157,List installed packages not found in sync database
$progname, $query,n,native, , ,158,list installed packages only found in sync database
$progname, $query,o,owns, , ,159,Query the package that owns FILE
$progname, $query,p,file, , ,160,Query a package file instead of the database
$progname, $query,s,search, , ,161,Search locally-installed packages for regexp
$progname, $query,t,unrequired, , ,162,List only unrequired packages [and optdepends]
$progname, $query,u,upgrades, , ,163,List only out-of-date packages
$progname, $query, , ,$listinstalled, ,164,Installed package
$progname, $remove,c,cascade, , ,165,Also remove packages depending on PACKAGE
$progname, $remove,n,nosave, , ,166,Ignore file backup designations
$progname, $remove,s,recursive, , ,167,Also remove dependencies of PACKAGE
$progname, $remove,u,unneeded, , ,168,Only remove targets not required by PACKAGE
$progname, $remove, ,local, , ,169,Also remove the package from the local repo
$progname, $remove, , ,$listinstalled, ,170,Installed package
$progname, $sync,c,clean, , ,171,Remove [all] packages from cache
$progname, $sync,i,info, , ,172,View PACKAGE [extended] information
$progname, $sync,l,list,$listrepos, ,173,List all packages in REPOSITORY
$progname, $sync,s,search, , ,174,Search remote repositories for regexp
$progname, $sync,u,sysupgrade, , ,175,Upgrade all packages that are out of date
$progname, $sync,w,downloadonly, , ,176,Only download the target packages
$progname, $sync, , ,$listall $listgroups, ,177, 
$progname, $upgrade,i,install, , ,178,Install package as well as building
$progname, $noopt,P,show, ,@f,179,Print information
$progname, $noopt,G,getpkgbuild, ,@f,180,Get PKGBUILD from ABS or AUR
$progname, $noopt,L,repoctl, ,@f,181,List local repos
$progname, $noopt,C,chrootctl, ,@f,182,Interactive shell to the chroot
$progname, $noopt,c,clean, , ,183,Remove unneeded dependencies
$progname, $noopt, ,gendb, , ,184,Generate development package DB
$progname, $show,w,news, , ,185,Print arch news
$progname, $show,s,stats, , ,186,Display system package statistics
$progname, $getpkgbuild,p,print, , ,187,Print PKGBUILD instead of downloading
$progname, $getpkgbuild,c,comments, , ,188,Print the AUR comments from the PKGBUILD's AUR page
$progname, $getpkgbuild, , ,$listall, ,189, 
$progname, $repoctl,l,list, , ,190,List packages in local repos
$progname, $repoctl,d,delete, , ,191,Remove a package from the local repo
$progname, $repoctl,q,quiet, , ,192,Show less information
$progname, $repoctl,y,refresh, , ,193,Refresh local repos
$progname, $repoctl,c,clean, , ,194,Remove uninstalled packages from repos
$progname, $chrootctl,i,install,$listpacman, ,195,Install a package into the chroot
$progname, $chrootctl,u,sysupgrade, , ,196,Upgrade the chroot
$progname, $noopt, ,repo, , ,197,Assume targets are from the repositories
$progname, $noopt,a,aur, , ,198,Assume targets are from the AUR
$progname, $noopt, ,aururl, , ,199,Set an alternative AUR URL
$progname, $noopt, ,aurrpcurl, , ,200,Set an alternative URL for the AUR /rpc endpoint
$progname, $noopt, ,clonedir, , ,201,Directory used to download and run PKGBUILDs
$progname, $noopt, ,makepkg, , ,202,Makepkg command to use
$progname, $noopt, ,pacman, , ,203,Pacman command to use
$progname, $noopt, ,pacman-conf, , ,204,Pacman-conf command to use
$progname, $noopt, ,git, , ,205,Git command to use
$progname, $noopt, ,asp, , ,206,Asp command to use
$progname, $noopt, ,gpg, , ,207,Gpg command to use
$progname, $noopt, ,fm, , ,208,File manager to use
$progname, $noopt, ,pager, , ,209,Pager command to use
$progname, $noopt, ,completioninterval, , ,210,Refresh interval for completion cache
$progname, $noopt, ,sortby,{votes,popularity,id,baseid,name,base,submitted,modified}, ,211,Sort AUR results by a specific field during search
$progname, $noopt, ,searchby,{name,name-desc,maintainer,depends,checkdepends,makedepends,optdepends}, ,212,Search for AUR packages by querying the specified field
$progname, $noopt, ,limit, , ,213,Limit number of search results
$progname, $noopt, ,upgrademenu, , ,214,Show a detailed list of updates with the option to skip any
$progname, $noopt, ,noupgrademenu, , ,215,Do not show the upgrade menu
$progname, $noopt, ,removemake, , ,216,Remove make deps after install
$progname, $noopt, ,noremovemake, , ,217,Do not remove make deps after install
$progname, $noopt, ,topdown, , ,218,Shows repository packages first and then aur
$progname, $noopt, ,bottomup, , ,219,Shows aur packages first and then repository
$progname, $noopt, ,devel, , ,220,Check -git/-svn/-hg development version
$progname, $noopt, ,nodevel, , ,221,Disable development version checking
$progname, $noopt, ,develsuffixes, , ,222,Suffixes to define development packages
$progname, $noopt, ,cleanafter, , ,223,Clean package sources after successful build
$progname, $noopt, ,nocleanafter, , ,224,Disable package sources cleaning
$progname, $noopt, ,redownload, , ,225,Redownload PKGBUILD of package even if up-to-date
$progname, $noopt, ,noredownload, , ,226,Do not redownload up-to-date PKGBUILDs
$progname, $noopt, ,provides, , ,227,Look for matching providers when searching for packages
$progname, $noopt, ,noprovides, , ,228,Just look for packages by pkgname
$progname, $noopt, ,pgpfetch, , ,229,Prompt to import PGP keys from PKGBUILDs
$progname, $noopt, ,nopgpfetch, , ,230,Do not prompt to import PGP keys
$progname, $noopt, ,newsonupgrade, , ,231,Print new news during sysupgrade
$progname, $noopt, ,useask, , ,232,Automatically resolve conflicts using pacmans ask flag
$progname, $noopt, ,nouseask, , ,233,Confirm conflicts manually during the install
$progname, $noopt, ,savechanges, , ,234,Commit changes to pkgbuilds made during review
$progname, $noopt, ,nosavechanges, , ,235,Don't commit changes to pkgbuilds made during review
$progname, $noopt, ,failfast, , ,236,Exit as soon as any AUR packages fail to build
$progname, $noopt, ,nofailfast, , ,237,Don't Exit as soon as any AUR packages fail to build
$progname, $noopt, ,keepsrc, , ,238,Keep src/ and pkg/ directories after building packages
$progname, $noopt, ,nokeepsrc, , ,239,Don't keep src/ and pkg/ directories after building packages
$progname, $noopt, ,combinedupgrade, , ,240,Refresh then perform the repo and AUR upgrade together
$progname, $noopt, ,nocombinedupgrade, , ,241,Perform the repo upgrade and AUR upgrade separately
$progname, $noopt, ,batchinstall, , ,242,Build multiple AUR packages then install them together
$progname, $noopt, ,nobatchinstall, , ,243,Build and install each AUR package one by one
$progname, $noopt, ,rebuild, , ,244,Always build target packages
$progname, $noopt, ,norebuild, , ,245,Skip package build if in cache and up to date
$progname, $noopt, ,mflags, , ,246,Pass the following options to makepkg
$progname, $noopt, ,gitflags, , ,247,Pass the following options to git
$progname, $noopt, ,gpgflags, , ,248,Pass the following options to gpg
$progname, $noopt, ,sudoflags, , ,249,Pass the following options to sudo
$progname, $noopt, ,batflags, , ,250,Pass the following options to sudo
$progname, $noopt, ,fmflags, , ,251,Pass the following options to file manager
$progname, $noopt, ,chrootflags, , ,252,Pass the following options to makechrootpkg
$progname, $noopt, ,sudoloop, , ,253,Loop sudo calls in the background to avoid timeout
$progname, $noopt, ,nosudoloop, , ,254,Do not loop sudo calls in the background
$progname, $noopt, ,chroot, , ,255,Build packages in a chroot
$progname, $noopt, ,nochroot, , ,256,Don't build packages in a chroot
$progname, $noopt, ,sign, , ,257,Sign packages with gpg
$progname, $noopt, ,nosign, , ,258,Don't sign packages with gpg
$progname, $noopt, ,keeprepocache, , ,259,Keep old versions of packages with local repo
$progname, $noopt, ,nokeeprepocache, , ,260,Don't keep old versions of packages with local repo
$progname, $noopt, ,signdb, , ,261,Sign databases with gpg
$progname, $noopt, ,nosigndb, , ,262,Don't sign databases with gpg
$progname, $noopt, ,localrepo, , ,263,Build packages in a local repo
$progname, $noopt, ,nolocalrepo, , ,264,Don't build packages in a local repo
$progname, $noopt, ,skipreview, , ,265,Skip the review process
$progname, $noopt, ,review, , ,266,Don't skip the review process
